Microsoft Windows [Version 10.0.18363.1256]
(c) 2019 Microsoft Corporation. All rights reserved.

C:\Users\gr0009au>mysql -u root -p
Enter password: *******
Welcome to the MySQL monitor.  Commands end with ; or \g.
Your MySQL connection id is 15
Server version: 8.0.23 MySQL Community Server - GPL

Copyright (c) 2000, 2021, Oracle and/or its affiliates.

Oracle is a registered trademark of Oracle Corporation and/or its
affiliates. Other names may be trademarks of their respective
owners.

Type 'help;' or '\h' for help. Type '\c' to clear the current input statement.

mysql> use trv11;
Database changed
mysql> show databases;
+--------------------+
| Database           |
+--------------------+
| flightdetails      |
| fruits             |
| information_schema |
| mysql              |
| nyka               |
| online_batch       |
| performance_schema |
| sakila             |
| sys                |
| trv11              |
| world              |
| xworkz             |
+--------------------+
12 rows in set (0.00 sec)

mysql> desc movie;
+-----------+-------------+------+-----+---------+-------+
| Field     | Type        | Null | Key | Default | Extra |
+-----------+-------------+------+-----+---------+-------+
| movieId   | int         | NO   | PRI | NULL    |       |
| name      | varchar(45) | YES  |     | NULL    |       |
| duriation | float       | YES  |     | NULL    |       |
+-----------+-------------+------+-----+---------+-------+
3 rows in set (0.02 sec)


mysql> insert into movie values(1,'Dia',2.20);
Query OK, 1 row affected (0.11 sec)

mysql> select * from movie;
+---------+------+-----------+
| movieId | name | duriation |
+---------+------+-----------+
|       1 | Dia  |       2.2 |
+---------+------+-----------+
1 row in set (0.10 sec)


mysql> select * from movie;
+---------+------+-----------+
| movieId | name | duriation |
+---------+------+-----------+
|       1 | Dia  |       2.2 |
+---------+------+-----------+
1 row in set (0.00 sec)

mysql> insert into movie values(2,'KGF',3.0);
Query OK, 1 row affected (0.09 sec)

mysql> select * from movie;
+---------+------+-----------+
| movieId | name | duriation |
+---------+------+-----------+
|       1 | Dia  |       2.2 |
|       2 | KGF  |         3 |
+---------+------+-----------+
2 rows in set (0.00 sec)


mysql> update movie
    -> set duriation=2.0
    -> ;
Query OK, 2 rows affected (0.20 sec)
Rows matched: 2  Changed: 2  Warnings: 0

mysql> select * from movie;
+---------+------+-----------+
| movieId | name | duriation |
+---------+------+-----------+
|       1 | Dia  |         2 |
|       2 | KGF  |         2 |
+---------+------+-----------+
2 rows in set (0.00 sec)

mysql> update movie
    -> set duriation=3
    -> ;
Query OK, 2 rows affected (0.09 sec)
Rows matched: 2  Changed: 2  Warnings: 0

mysql> select * from movie;
+---------+------+-----------+
| movieId | name | duriation |
+---------+------+-----------+
|       1 | Dia  |         3 |
|       2 | KGF  |         3 |
+---------+------+-----------+
2 rows in set (0.10 sec)


mysql> update movie
    -> set duriation=2
    -> where movieId=1;
Query OK, 1 row affected (0.09 sec)
Rows matched: 1  Changed: 1  Warnings: 0

mysql> select * from movie;
+---------+------+-----------+
| movieId | name | duriation |
+---------+------+-----------+
|       1 | Dia  |         2 |
|       2 | KGF  |         3 |
+---------+------+-----------+
2 rows in set (0.02 sec)


mysql> delete from movie
    -> where movieId=2;
Query OK, 1 row affected (0.18 sec)

mysql> select * from movie;
+---------+------+-----------+
| movieId | name | duriation |
+---------+------+-----------+
|       1 | Dia  |         2 |
+---------+------+-----------+
1 row in set (0.01 sec)

mysql> update movie
    -> set duriation=2
    -> where movieId=2;
Query OK, 0 rows affected (0.00 sec)
Rows matched: 0  Changed: 0  Warnings: 0

mysql> select * from movie;
+---------+------+-----------+
| movieId | name | duriation |
+---------+------+-----------+
|       1 | Dia  |         2 |
+---------+------+-----------+
1 row in set (0.00 sec)


mysql> alter table movie
    -> rename to movie_table;
Query OK, 0 rows affected (1.45 sec)

mysql> desc movie;
ERROR 1146 (42S02): Table 'trv11.movie' doesn't exist
mysql> desc movie_table;
+-----------+-------------+------+-----+---------+-------+
| Field     | Type        | Null | Key | Default | Extra |
+-----------+-------------+------+-----+---------+-------+
| movieId   | int         | NO   | PRI | NULL    |       |
| name      | varchar(45) | YES  |     | NULL    |       |
| duriation | float       | YES  |     | NULL    |       |
+-----------+-------------+------+-----+---------+-------+
3 rows in set (0.04 sec)

mysql> alter table movie_table
    -> rename to movie;
Query OK, 0 rows affected (0.48 sec)

mysql> desc movie;
+-----------+-------------+------+-----+---------+-------+
| Field     | Type        | Null | Key | Default | Extra |
+-----------+-------------+------+-----+---------+-------+
| movieId   | int         | NO   | PRI | NULL    |       |
| name      | varchar(45) | YES  |     | NULL    |       |
| duriation | float       | YES  |     | NULL    |       |
+-----------+-------------+------+-----+---------+-------+
3 rows in set (0.16 sec)


mysql>show tables;
+-----------------+
| Tables_in_trv11 |
+-----------------+
| movie           |
+-----------------+
1 row in set (0.03 sec)




mysql> desc emp;
+----------+---------------+------+-----+---------+-------+
| Field    | Type          | Null | Key | Default | Extra |
+----------+---------------+------+-----+---------+-------+
| empno    | int           | NO   | PRI | NULL    |       |
| empname  | varchar(45)   | YES  |     | NULL    |       |
| job      | varchar(45)   | YES  |     | NULL    |       |
| mgr      | int           | YES  |     | NULL    |       |
| hiredate | date          | YES  |     | NULL    |       |
| salary   | decimal(10,0) | YES  |     | NULL    |       |
| comm     | decimal(10,0) | YES  |     | NULL    |       |
| deptno   | int           | YES  |     | NULL    |       |
+----------+---------------+------+-----+---------+-------+
8 rows in set (0.00 sec)




mysql> show tables;
+-----------------+
| Tables_in_trv11 |
+-----------------+
| emp             |
| movie           |
+-----------------+
2 rows in set (0.01 sec)

mysql> select * from emp
    -> where deptno in (10,20);
+-------+---------+---------+------+------------+--------+------+--------+
| empno | empname | job     | mgr  | hiredate   | salary | comm | deptno |
+-------+---------+---------+------+------------+--------+------+--------+
|     1 | Pooja   | Clerk   | 1234 | 2021-03-14 |  14099 |  200 |     20 |
|     2 | Ranju   | Clerk   | 1334 | 2021-04-25 |  19000 |  200 |     20 |
|     4 | Jhan    | Manager | 1389 | 1896-05-20 |  20000 |  400 |     10 |
+-------+---------+---------+------+------------+--------+------+--------+
3 rows in set (0.01 sec)


mysql> select * from emp
    -> where deptno in (10,20,30);
+-------+---------+---------+------+------------+--------+------+--------+
| empno | empname | job     | mgr  | hiredate   | salary | comm | deptno |
+-------+---------+---------+------+------------+--------+------+--------+
|     1 | Pooja   | Clerk   | 1234 | 2021-03-14 |  14099 |  200 |     20 |
|     2 | Ranju   | Clerk   | 1334 | 2021-04-25 |  19000 |  200 |     20 |
|     3 | Jhan    | Manager | 1590 | 1786-04-25 |  10000 |  500 |     30 |
|     4 | Jhan    | Manager | 1389 | 1896-05-20 |  20000 |  400 |     10 |
+-------+---------+---------+------+------------+--------+------+--------+
4 rows in set (0.00 sec)

mysql> select * from emp
    -> where empname like '%a_';
+-------+---------+---------+------+------------+--------+------+--------+
| empno | empname | job     | mgr  | hiredate   | salary | comm | deptno |
+-------+---------+---------+------+------------+--------+------+--------+
|     3 | Jhan    | Manager | 1590 | 1786-04-25 |  10000 |  500 |     30 |
|     4 | Jhan    | Manager | 1389 | 1896-05-20 |  20000 |  400 |     10 |
+-------+---------+---------+------+------------+--------+------+--------+
2 rows in set (0.00 sec)


mysql> select * from emp
    -> where empname like 'R%';
+-------+---------+---------+------+------------+--------+------+--------+
| empno | empname | job     | mgr  | hiredate   | salary | comm | deptno |
+-------+---------+---------+------+------------+--------+------+--------+
|     2 | Ranju   | Clerk   | 1334 | 2021-04-25 |  19000 |  200 |     20 |
|     5 | Ravi    | Analyst | 1389 | 1698-07-08 |  19000 |  100 |     50 |
+-------+---------+---------+------+------------+--------+------+--------+
2 rows in set (0.00 sec)

mysql> select * from emp
    -> where empname like '%a_';
+-------+---------+---------+------+------------+--------+------+--------+
| empno | empname | job     | mgr  | hiredate   | salary | comm | deptno |
+-------+---------+---------+------+------------+--------+------+--------+
|     3 | Jhan    | Manager | 1590 | 1786-04-25 |  10000 |  500 |     30 |
|     4 | Jhan    | Manager | 1389 | 1896-05-20 |  20000 |  400 |     10 |
+-------+---------+---------+------+------------+--------+------+--------+
2 rows in set (0.00 sec)

mysql> select * from emp
    -> where salary between 2000 and 20000;
+-------+---------+---------+------+------------+--------+------+--------+
| empno | empname | job     | mgr  | hiredate   | salary | comm | deptno |
+-------+---------+---------+------+------------+--------+------+--------+
|     1 | Pooja   | Clerk   | 1234 | 2021-03-14 |  14099 |  200 |     20 |
|     2 | Ranju   | Clerk   | 1334 | 2021-04-25 |  19000 |  200 |     20 |
|     3 | Jhan    | Manager | 1590 | 1786-04-25 |  10000 |  500 |     30 |
|     4 | Jhan    | Manager | 1389 | 1896-05-20 |  20000 |  400 |     10 |
|     5 | Ravi    | Analyst | 1389 | 1698-07-08 |  19000 |  100 |     50 |
+-------+---------+---------+------+------------+--------+------+--------+
5 rows in set (0.02 sec)

mysql> select * from emp
    -> where salary between 0 and 10000;
+-------+---------+---------+------+------------+--------+------+--------+
| empno | empname | job     | mgr  | hiredate   | salary | comm | deptno |
+-------+---------+---------+------+------------+--------+------+--------+
|     3 | Jhan    | Manager | 1590 | 1786-04-25 |  10000 |  500 |     30 |
+-------+---------+---------+------+------------+--------+------+--------+
1 row in set (0.00 sec)